content_type,title,description,url,date,document_type,price,related_products,length,views
Product,Pro Tools Ultimate - Annual Subscription,"Produce high-end music and create sound for film/TV. Get over $2,500 USD worth of additional products and services for free with the Inner Circle plus a monthly Sonic Drop of exclusive new samples loops and/or instrument presets",https://www.avid.com/search#tab=Products&numberOfResults=60,,,789.00,,,
Product,Pro Tools Studio - Annual Subscription,"Create immersive music with tons of plugins virtual instruments loops and more. Get over $2,500 USD worth of additional products and services for free with the Inner Circle plus a monthly Sonic Drop of exclusive new samples loops and/or instrument presets",https://www.avid.com/search#tab=Products&numberOfResults=60,,,389.00,,,
Product,Pro Tools Artist - Annual Subscription,"Create music with 100+ plugins and virtual instruments plus a premium loop library. Get over $2,500 USD worth of additional products and services for free with the Inner Circle plus a monthly Sonic Drop of exclusive new samples loops and/or instrument presets",https://www.avid.com/search#tab=Products&numberOfResults=60,,,129.00,,,
Product,Pro Tools Intro,Pro Tools Intro is a free DAW that gives you the essential audio and MIDI tools you need for music production plus 36 effects and instrument plugins to create any type of music.,https://www.avid.com/search#tab=Products&numberOfResults=60,,,0,,,
Product,Sibelius First,With Sibelius - First you can start composing music using the same tools professional composers use.,https://www.avid.com/search#tab=Products&numberOfResults=60,,,0,,,
Product,Sibelius Ultimate Trial,Experience the fastest smartest easiest way to write music with Sibelius-the world's best-selling music notation software.,https://www.avid.com/search#tab=Products&numberOfResults=60,,,0,,,
Product,Sibelius First (Duplicate),Free music notation software entry.,https://www.avid.com/search#tab=Products&numberOfResults=60,,,0,,,
Product,Pro Tools Fundamentals I (PT101) - 2022 in Spanish,This introductory book takes a comprehensive approach to teaching the fundamentals of using a Pro Tools system. Media and sessions are included with the book making it easy to put concepts covered in the lessons into practice.,https://www.avid.com/search#tab=Products&numberOfResults=60,,,60.00,,,
Product,Media Composer - Ultimate - 3 Year Subscription (Paid Upfront),Get access to the Media Composer - PhraseFind AI Option ScriptSync AI Option Symphony Option and NewsCutter Option throughout your subscription,https://www.avid.com/search#tab=Products&numberOfResults=60,,,1909.00,,,
Product,Media Composer Professional Editing II (MC210) v8.6 in English,Practice essential long-form skills you can apply to most projects.,https://www.avid.com/search#tab=Products&numberOfResults=60,,,140.00,,,
Product,Media Composer Fundamentals II (MC110) 2019/20 in English,Level up your Media Composer editing and technical skills,https://www.avid.com/search#tab=Products&numberOfResults=60,,,92.00,,,
Product,Sibelius Ultimate - Annual Subscription,Get access to all new releases and the Sibelius Ultimate mobile app for one year,https://www.avid.com/search#tab=Products&numberOfResults=60,,,259.95,,,
Product,Sibelius Ultimate for Teams - Annual Subscription,Get the smartest fastest easiest way to create and edit scores for any size ensemble with the best-selling music notation software,https://www.avid.com/search#tab=Products&numberOfResults=60,,,259.95,,,
Product,Sibelius Artist - Monthly Subscription,Create edit and share scores written for smaller ensembles (up to 16 staves) with the basic music notation toolset and features,https://www.avid.com/search#tab=Products&numberOfResults=60,,,16.95,,,
Product,Sibelius Ultimate - Monthly Subscription,Get the smartest fastest easiest way to create and edit scores for any size ensemble with the best-selling music notation software,https://www.avid.com/search#tab=Products&numberOfResults=60,,,39.95,,,
Product,Pro Tools Studio - Monthly Subscription,Discover the power of Avid Pro Tools for professional audio recording editing and mixing. Elevate your music and sound production to new heights.,https://www.avid.com/search#tab=Products&numberOfResults=60,,,46.00,,,
Product,Media Composer - Ultimate - Monthly Subscription,Avid Media Composer is the most trusted professional video editing software for filmmakers designed for film television and more.,https://www.avid.com/search#tab=Products&numberOfResults=60,,,106.00,,,
Product,HEAT,Add analog warmth and color to Pro Tools and Pro Tools - Ultimate mixes. Or get HEAT included at no extra charge with any Pro Tools or Pro Tools - Ultimate subscription,https://www.avid.com/search#tab=Products&numberOfResults=60,,,259.00,,,
Product,Sibelius Ultimate Perpetual License NEW + AudioScore Ultimate - Full License,Buy the best-selling music notation software and own it forever with a perpetual license that never expires (includes a support plan),https://www.avid.com/search#tab=Products&numberOfResults=60,,,979.95,,,
Product,Pro Series Bundle - Full License,The plugins featured in the Pro Series are some of the most powerful in the Avid catalog perfect for both music and audio-post and with full surround support.,https://www.avid.com/search#tab=Products&numberOfResults=60,,,917.00,,,
Product,Media Composer Ultimate - Annual Subscription,Get access to the Media Composer - PhraseFind AI Option ScriptSync AI Option Symphony Option and NewsCutter Option throughout your subscription,https://www.avid.com/search#tab=Products&numberOfResults=60,,,709.00,,,
Product,Pro Tools Production II (Music Production) (PT210M) - 2018/19 in English,Pro Tools is found in professional music studios project studios and bedroom studios the world over and is the industry's chosen standard for music production. In this book which builds on concepts covered in the PT101 PT110 and PT201 books you'll learn how to create record edit and mix music using the best tools in the business!,https://www.avid.com/search#tab=Products&numberOfResults=60,,,140.00,,,
Product,Media Composer Professional Editing I (MC201) eBook,Use the included projects and media to practice professional level workflows. Immerse yourself in advanced picture editing skills multicam workflows and next level compositing with 3D Warp. Walk away with in-depth insights on how to streamline your ingest process advance your audio skills and work with diverse graphic formats,https://www.avid.com/search#tab=Products&numberOfResults=60,,,120.00,,,
Product,Media Composer Fundamentals I (MC101) - 2022 in English,Learn the essential tools and workflows to get started quickly in Media Composer. By the end of this book you'll have what you need to build your film streaming series or paid assignment from start to output.,https://www.avid.com/search#tab=Products&numberOfResults=60,,,60.00,,,
Product,Media Composer Subscription (2 Years),Avid Media Composer is the most trusted professional video editing software for filmmakers designed for film television and more.,https://www.avid.com/search#tab=Products&numberOfResults=60,,,1199.00,,,
Product,Media Composer - Symphony Subscription NEW - Monthly Paid Monthly,Professionally correct color and master projects faster with the Media Composer - Symphony Option.,https://www.avid.com/search#tab=Products&numberOfResults=60,,,33.00,,,
Product,Media Composer Team - Monthly Paid Monthly,Avid Media Composer is the most trusted professional video editing software for filmmakers designed for film television and more.,https://www.avid.com/search#tab=Products&numberOfResults=60,,,51.00,,,
Product,Media Composer - PhraseFind Subscription NEW - Monthly Paid Monthly,Media Composer - PhraseFind accelerates your video editing with powerful dialog search.,https://www.avid.com/search#tab=Products&numberOfResults=60,,,33.00,,,
Product,Pro Tools Production II (Music Production) (PT210M) - 2021 in English,Pro Tools is found in professional music studios project studios and bedroom studios the world over and is the industry's chosen standard for music production. In this book which builds on concepts covered in the PT101 PT110 and PT201 books you'll learn how to create record edit and mix music using the best tools in the business!,https://www.avid.com/search#tab=Products&numberOfResults=60,,,140.00,,,
Product,Pro Tools 101: Pro Tools Fundamentals I - Ebook,This introductory book takes a comprehensive approach to teaching the fundamentals of using a Pro Tools system. Updated for Pro Tools 2022.4 software this new edition covers everything you need to know to complete a Pro Tools project using Pro Tools Artist Pro Tools Studio or Pro Tools Ultimate.,https://www.avid.com/search#tab=Products&numberOfResults=60,,,65.00,,,
Product,Pro Tools Ultimate - Monthly Subscription,Discover the power of Avid Pro Tools for professional audio recording editing and mixing. Elevate your music and sound production to new heights.,https://www.avid.com/search#tab=Products&numberOfResults=60,,,129.00,,,
Product,Pro Tools Production II (Music Production)(PT210M) - 2024 in English,Pro Tools is found in professional music studios project studios and bedroom studios the world over and is the industry's chosen standard for music production. In this book which builds on concepts covered in the PT101 PT110 and PT201 books you'll learn how to create record edit and mix music using the best tools in the business!,https://www.avid.com/search#tab=Products&numberOfResults=60,,,140.00,,,
Product,Sibelius Ultimate for Teams - Monthly Subscription,Get the smartest fastest easiest way to create and edit scores for any size ensemble with the best-selling music notation software,https://www.avid.com/search#tab=Products&numberOfResults=60,,,39.95,,,
Product,Pro Tools Fundamentals I (PT101) - 2022 in Japanese,This introductory book takes a comprehensive approach to teaching the fundamentals of using a Pro Tools system. Media and sessions are included with the book making it easy to put concepts covered in the lessons into practice.,https://www.avid.com/search#tab=Products&numberOfResults=60,,,60.00,,,
Product,Media Composer Fundamentals I (MC101) 2019/20 in English,Master the basics of video editing with Media Composer Fundamentals I (MC101) 2019/20 learn essential workflows and tools in English.,https://www.avid.com/search#tab=Products&numberOfResults=60,,,60.00,,,
Product,AvidPlay Unlimited Stereo Music Distribution Annual Paid Upfront,Distribute your music on top streaming services all over the world-from Spotify Apple Music and Tidal to Instagram TikTok and more. AvidPlay makes it easy to reach your fans wherever they may be and however they like to listen.,https://www.avid.com/search#tab=Products&numberOfResults=60,,,32.00,,,
Product,PhotoScore & NotateMe Ultimate,Scan printed music and handwrite scores to complement your Sibelius workflow,https://www.avid.com/search#tab=Products&numberOfResults=60,,,329.95,,,
Product,Media Composer Fundamentals II (MC110) 2019/20 in Spanish,Advance your video editing skills with Media Composer Fundamentals II (MC110) 2019/20 covering intermediate workflows and techniques in Spanish.,https://www.avid.com/search#tab=Products&numberOfResults=60,,,92.00,,,
Product,Media Composer Fundamentals I (MC101) - 2019/20 in Spanish,Media Composer Fundamentals I is an introductory book designed to get new users up-and-running quickly on Media Composer.,https://www.avid.com/search#tab=Products&numberOfResults=60,,,60.00,,,
Product,Media Composer - Monthly Subscription,Avid Media Composer is the most trusted professional video editing software for filmmakers designed for film television and more.,https://www.avid.com/search#tab=Products&numberOfResults=60,,,56.00,,,
Product,Sibelius Ultimate Perpetual Bundle,Buy the best-selling music notation software and own it forever with a perpetual license that never expires (includes a support plan),https://www.avid.com/search#tab=Products&numberOfResults=60,,,1199.95,,,
Product,Pro Tools Artist - Monthly Subscription,Discover the power of Avid Pro Tools for professional audio recording editing and mixing. Elevate your music and sound production to new heights.,https://www.avid.com/search#tab=Products&numberOfResults=60,,,12.99,,,
Product,Avid VENUE S6L Production (VE210S6L) V5.5 in English,The Avid VENUE - S6L Production book is a continuation of the fundamentals taught in the VE110 S6L course that dives deeper into the advanced features of the system.,https://www.avid.com/search#tab=Products&numberOfResults=60,,,140.00,,,
Product,Pro Tools for Game Audio (PT130) 2020/21 in English,Along with music and audio post-production the game audio industry is huge and it's growing all the time. Building on concepts covered in the PT101 book the PT130 Pro Tools for Game Audio book teaches you how to create stunning game audio using the audio industry's leading Digital Audio Workstation (DAW).,https://www.avid.com/search#tab=Products&numberOfResults=60,,,92.00,,,
Product,Pro Tools Fundamentals II (PT110) 2022 in Spanish,This book builds on the foundation laid by the Pro Tools 101 book exploring the industry-standard Pro Tools Digital Audio Workstation (DAW) in greater detail and preparing students for entry-level positions in virtually any aspect of the audio industry.,https://www.avid.com/search#tab=Products&numberOfResults=60,,,92.00,,,
Product,Pro Tools Production I (PT201) 2024 in English,Building on features and techniques covered in the PT101 and PT110 books the PT201 Pro Tools Production I book steps into the world of Pro Tools Ultimate software using HDX- and HD - Native-based hardware setups. In this book you'll learn how to set up and use these powerful systems found in professional studios around the world.,https://www.avid.com/search#tab=Products&numberOfResults=60,,,120.00,,,
Product,Pro Tools Ultimate for EDU - Annual Subscription,Discover the power of Avid Pro Tools for professional audio recording editing and mixing. Elevate your music and sound production to new heights.,https://www.avid.com/search#tab=Products&numberOfResults=60,,,389.95,,,
Product,Pro Tools Production I (PT201) 2021 in English,Building on features and techniques covered in the PT101 and PT110 books the PT201 Pro Tools Production I book steps into the world of Pro Tools Ultimate software using HDX- and HD - Native-based hardware setups. In this book you'll learn how to set up and use these powerful systems found in professional studios around the world.,https://www.avid.com/search#tab=Products&numberOfResults=60,,,120.00,,,
Product,Media Composer 110: Media Composer Fundamentals II - Ebook,Level up your Media Composer editing and technical skills. Throughout this book you'll build on the foundation you established with the Media Composer Fundamentals I book.,https://www.avid.com/search#tab=Products&numberOfResults=60,,,78.00,,,
Product,Sibelius Ultimate Education Perpetual,Get the smartest fastest easiest way to create and edit scores for any size ensemble with the best-selling music notation software,https://www.avid.com/search#tab=Products&numberOfResults=60,,,389.95,,,
Product,Media Composer - Ultimate for Teams - Annual Subscription,Avid Media Composer is the most trusted professional video editing software for filmmakers designed for film television and more.,https://www.avid.com/search#tab=Products&numberOfResults=60,,,769.00,,,
Product,Media Composer Ultimate Team - Monthly Paid Monthly,Avid Media Composer is the most trusted professional video editing software for filmmakers designed for film television and more.,https://www.avid.com/search#tab=Products&numberOfResults=60,,,109.00,,,
Product,Pro Tools LE Support,Get expert technical advice for Pro Tools Studio at Avid Support code. Available in North America South America Europe and Japan,https://www.avid.com/search#tab=Products&numberOfResults=60,,,39.95,,,
Product,Pro Tools Production II Post Production (PT210P) 2024 in English,Enhance your post-production skills with Pro Tools Production II Post Production (PT210P) 2024 covering advanced editing mixing and finishing techniques in English.,https://www.avid.com/search#tab=Products&numberOfResults=60,,,140.00,,,
Product,Pro Tools Production I (PT201) 2018/19 in English,Building on features and techniques covered in the PT101 and PT110 books the PT201 Pro Tools Production I book steps into the world of Pro Tools Ultimate software using HDX- and HD - Native-based hardware setups. In this book you'll learn how to set up and use these powerful systems found in professional studios around the world.,https://www.avid.com/search#tab=Products&numberOfResults=60,,,120.00,,,
Product,Sibelius Ultimate Upgrade inc. 1 year of upgrades,Get the smartest fastest easiest way to create and edit scores for any size ensemble with the best-selling music notation software,https://www.avid.com/search#tab=Products&numberOfResults=60,,,130.00,,,
Product,Media Composer Team - Termed - Annual Paid Upfront,Avid Media Composer is the most trusted professional video editing software for filmmakers designed for film television and more.,https://www.avid.com/search#tab=Products&numberOfResults=60,,,409.00,,,
Product,Sibelius Artist Upgrade inc. 1 year of upgrades,Get the smartest fastest easiest way to create and edit scores for any size ensemble with the best-selling music notation software,https://www.avid.com/search#tab=Products&numberOfResults=60,,,64.00,,,
Product,AudioScore Ultimate-Full License,Quickly and easily turn CD tracks MP3s MIDI files and even your own vocal and instrument performances into detailed music notation.,https://www.avid.com/search#tab=Products&numberOfResults=60,,,329.95,,,
Product,Sibelius Ultimate EDU - Monthly,Enjoy a full toolset to compose arrange and engrave without limits,https://www.avid.com/search#tab=Products&numberOfResults=60,,,13.11,,,
Article,Pro Tools Perpetual Licensing and Upgrades,,https://kb.avid.com/articles/en_US/Knowledge/en418911,2026-04-28,Licensing,,Pro Tools,,
Article,Drivers for Avid Audio Hardware,,https://kb.avid.com/articles/en_US/Knowledge/en379411,2026-01-26,Download,,"Pro Tools, Pro Tools HD",,
Article,EUCON Application Setup,,https://kb.avid.com/articles/en_US/Knowledge/EuControl-3P-Setup,2026-01-26,How To,,EUCON,,
Article,Pro Tools Operating System Compatibility Chart,,https://kb.avid.com/articles/en_US/Knowledge/Pro-Tools-Operating-System-Compatibility-Chart,2026-04-28,Compatibility,,"Pro Tools, Pro Tools HD",,
Article,Pro Tools Common AAE Errors,,https://kb.avid.com/articles/en_US/Knowledge/AAE-Error-messages,2026-01-26,FAQ,,Pro Tools,,
Article,Pro Tools ドキュメント,,https://kb.avid.com/articles/ja/Knowledge/Pro-Tools-Documentation,2026-04-28,User Guide,,"Pro Tools, Pro Tools HD",,
Article,Pro Tools Documentation,,https://kb.avid.com/articles/en_US/Knowledge/Pro-Tools-Documentation,2026-04-28,User Guide,,"Pro Tools, Pro Tools HD",,
Article,Pro Tools ソフトウェア・サポート,,https://kb.avid.com/articles/ja/Knowledge/ja355241,2026-04-28,Download,,"Pro Tools, Pro Tools Express, Pro Tools HD, Pro Tools LE, Pro Tools M-Powered",,
Article,Pro Tools 更新,,https://kb.avid.com/articles/zh_CN/Knowledge/zh355241,2026-04-28,Download,,"Pro Tools, Pro Tools Express, Pro Tools HD, Pro Tools LE, Pro Tools M-Powered",,
Article,Pro Tools Software Support,,https://kb.avid.com/articles/en_US/Knowledge/en355241,2026-04-28,Download,,"Pro Tools, Pro Tools Express, Pro Tools HD, Pro Tools LE, Pro Tools M-Powered",,
Article,Pro Tools Patch Updates,,https://kb.avid.com/articles/en_US/Knowledge/en418911,2026-04-28,Download,,"Pro Tools, Pro Tools Express, Pro Tools First, Pro Tools HD",,
Article,Pro Toolsアップデートの最新版,,https://kb.avid.com/articles/ja/Knowledge/ja418911,2026-04-28,Download,,"Pro Tools, Pro Tools Express, Pro Tools First, Pro Tools HD",,
Article,Pro Tools最新版本的更新信息？,,https://kb.avid.com/articles/zh_CN/Knowledge/zh418911,2026-04-28,Download,,"Pro Tools, Pro Tools Express, Pro Tools First, Pro Tools HD",,
Article,Pro Tools と Media Composer を同一のシステムに混在させる際の注意点,,https://kb.avid.com/articles/ja/Knowledge/Pro-Tools-and-Media-Composer-Co-Install,2026-04-28,Compatibility,,"Media Composer, Pro Tools",,
Article,Pro Tools and Media Composer Co-Install,,https://kb.avid.com/articles/en_US/Knowledge/Pro-Tools-and-Media-Composer-Co-Install,2026-04-28,Compatibility,,"Media Composer, Pro Tools",,
Article,Pro Tools OS (オペレーティングシステム) 互換性 リスト,,https://kb.avid.com/articles/ja/Knowledge/Pro-Tools-Operating-System-Compatibility-Chart,2026-04-28,Compatibility,,"Pro Tools, Pro Tools HD",,
Article,ビデオ・サテライト および サテライト・リンク システム要件,,https://kb.avid.com/articles/ja/Knowledge/Video-Satellite-and-Satellite-Link-System-Requirements,2026-04-28,Compatibility,,"Pro Tools, Pro Tools HD",,
Article,Video Satellite and Satellite Link System Requirements,,https://kb.avid.com/articles/en_US/Knowledge/Video-Satellite-and-Satellite-Link-System-Requirements,2026-04-28,Compatibility,,"Pro Tools, Pro Tools HD",,
Article,Sibelius と Pro Tools を同一のシステムに混在させる際の注意点,,https://kb.avid.com/articles/ja/Knowledge/Sibelius-Pro-Tools-Co-Installation-Requirements,2026-04-28,Compatibility,,"Pro Tools, Pro Tools First, Pro Tools HD, Sibelius, Sibelius First",,
Article,Sibelius-Pro Tools Co-Installation Requirements,,https://kb.avid.com/articles/en_US/Knowledge/Sibelius-Pro-Tools-Co-Installation-Requirements,2026-04-28,Compatibility,,"Pro Tools, Pro Tools First, Pro Tools HD, Sibelius, Sibelius First",,
Article,Pro Tools システム要件,,https://kb.avid.com/articles/ja/Knowledge/Pro-Tools-System-Requirements,2026-04-28,Compatibility,,"Pro Tools, Pro Tools First, Pro Tools HD",,
Article,Pro Tools System Requirements and Compatibility,,https://kb.avid.com/articles/en_US/Knowledge/Pro-Tools-System-Requirements,2026-04-28,Compatibility,,"Pro Tools, Pro Tools First, Pro Tools HD",,
Article,Pro Tools Video Peripherals,,https://kb.avid.com/articles/en_US/Knowledge/Pro-Tools-Video-Peripherals,2026-04-28,Compatibility,,"Pro Tools, Pro Tools HD",,
Article,Pro Tools ビデオ・ペリフェラル,,https://kb.avid.com/articles/ja/Knowledge/Pro-Tools-Video-Peripherals,2026-04-28,Compatibility,,"Pro Tools, Pro Tools HD",,
Article,What Happens When I Change my Avid Account Email after registering for Pro Tools First?,,https://kb.avid.com/articles/en_US/Knowledge/What-Happens-When-I-Change-my-Avid-Account-Email-after-registering-for-Pro-Tools-First,2026-01-26,User Guide,,"Pro Tools, Pro Tools First",,
Article,Pro Tools 2020 Documentation,,https://kb.avid.com/articles/en_US/Knowledge/Pro-Tools-2020-Documentation,2026-01-26,User Guide,,,,
Article,Setting up HP RGS for Remote Workflows,,https://kb.avid.com/articles/en_US/Knowledge/Setting-up-HP-RGS-for-Remote-Workflows,2026-01-26,User Guide,,,,
Article,Pro Tools 2018 ドキュメント（英語版）,,https://kb.avid.com/articles/ja/Knowledge/Pro-Tools-2018-Documentation,2026-01-26,User Guide,,,,
Article,Pro Tools 2018 Documentation,,https://kb.avid.com/articles/en_US/Knowledge/Pro-Tools-2018-Documentation,2026-01-26,User Guide,,,,
Article,Pro Tools 2019 ドキュメント,,https://kb.avid.com/articles/ja/Knowledge/Pro-Tools-2019-Documentation,2026-01-26,User Guide,,"Pro Tools, Pro Tools First, Pro Tools HD",,
Article,Pro Tools 2019 Documentation,,https://kb.avid.com/articles/en_US/Knowledge/Pro-Tools-2019-Documentation,2026-01-26,User Guide,,"Pro Tools, Pro Tools First, Pro Tools HD",,
Article,Pro Tools 12 全ドキュメント,,https://kb.avid.com/articles/ja/Knowledge/Pro-Tools-12-Documentation,2026-01-27,User Guide,,"Pro Tools, Pro Tools HD",,
Article,Pro Tools 12 Documentation (All),,https://kb.avid.com/articles/en_US/Knowledge/Pro-Tools-12-Documentation,2026-01-27,User Guide,,"Pro Tools, Pro Tools HD",,
Article,OSX 10.15.4 は Pro Toolsと非互換です。,,https://kb.avid.com/articles/ja/Knowledge/OSX-10-15-4-compatibility-with-Pro-Tools,2026-02-23,Compatibility,,,,
Article,macOS 10.15.4 Compatibility with Pro Tools,,https://kb.avid.com/articles/en_US/Knowledge/OSX-10-15-4-compatibility-with-Pro-Tools,2026-02-23,Compatibility,,,,
Article,Pro Tools File Type Support on macOS Catalina,,https://kb.avid.com/articles/en_US/Knowledge/Pro-Tools-QuickTime,2026-02-23,Compatibility,,,,
Article,Pro Tools 10.3.10 情報 & ダウンロード,,https://kb.avid.com/articles/ja/Knowledge/Pro-Tools-10-3-10-Downloads,2026-01-26,Download,,"Pro Tools, Pro Tools HD",,
Article,Avid QuickTime Codecs LE,,https://kb.avid.com/articles/en_US/Knowledge/Avid-QuickTime-Codecs-LE,2026-01-26,Download,,Pro Tools,,
Article,Pro Tools 10.3.10 Info & Downloads,,https://kb.avid.com/articles/en_US/Knowledge/Pro-Tools-10-3-10-Downloads,2026-01-26,Download,,"Pro Tools, Pro Tools HD",,
Article,Pro Tools 2020.9 & 2020.9.1 リリース情報,,https://kb.avid.com/articles/ja/Knowledge/Pro-Tools-2020-9-Release-Info,2026-01-26,Download,,,,
Article,Pro Tools 2020.5 リリース情報,,https://kb.avid.com/articles/ja/Knowledge/Pro-Tools-2020-5-Release-Info,2026-01-26,Download,,,,
Article,Pro Tools 2020.3 リリース情報,,https://kb.avid.com/articles/ja/Knowledge/Pro-Tools-2020-3-Release-Info,2026-01-26,Download,,,,
Article,Pro Tools 2020.3 Release Info,,https://kb.avid.com/articles/en_US/Knowledge/Pro-Tools-2020-3-Release-Info,2026-01-26,Download,,,,
Article,Pro Tools 2018.7 リリース情報,,https://kb.avid.com/articles/ja/Knowledge/Pro-Tools-2018-7-Release-Info,2026-01-26,Download,,"Pro Tools, Pro Tools HD",,
Article,Pro Tools 2020.12 リリース情報,,https://kb.avid.com/articles/ja/Knowledge/Pro-Tools-2020-12-Release-Info,2026-01-26,Download,,,,
